{
  "id": "country-scale",
  "unit": "scales",
  "track": "scales",
  "title_key": "lesson-country-scale-title",
  "body_key": "lesson-country-scale-body",
  "chart": "song/chart.harpchart",
  "prerequisites": [
    "first-bend"
  ],
  "pass_criteria": {
    "type": "accuracy",
    "threshold": 0.6
  }
}
