{
  "id": "quick-change-improv",
  "unit": "blues",
  "track": "form",
  "title_key": "lesson-quick-change-improv-title",
  "body_key": "lesson-quick-change-improv-body",
  "chart": "song/chart.harpchart",
  "progression": "quick-change",
  "prerequisites": [
    "question-answer"
  ],
  "pass_criteria": {
    "type": "scale-adherence",
    "threshold": 0.8
  }
}
