{
  "id": "low-register",
  "unit": "navigation",
  "track": "navigation",
  "title_key": "lesson-low-register-title",
  "body_key": "lesson-low-register-body",
  "chart": "song/chart.harpchart",
  "prerequisites": [
    "crossing-three-four"
  ],
  "pass_criteria": {
    "type": "accuracy",
    "threshold": 0.55
  }
}
